{
  "id": "eir-to-nominal",
  "playgroundSlug": "interest",
  "difficulty": "intermediaire",
  "template": {
    "promptKey": "int.exercise.eir-to-nominal.prompt",
    "parameters": [
      { "name": "eir", "type": "rate", "min": 5, "max": 20, "step": 0.5 }
    ]
  },
  "solutionLogic": {
    "solverFunction": "eirToNominal",
    "answerType": "numeric",
    "tolerance": 0.0001,
    "toleranceType": "absolute",
    "partialCredit": false
  },
  "feedbackTemplates": {
    "correct": "int.exercise.eir-to-nominal.correct",
    "incorrect": "int.exercise.eir-to-nominal.incorrect"
  }
}
