{
  "id": "tvm-f02-retirement-nest-egg",
  "playgroundSlug": "tvm",
  "difficulty": "fondamental",
  "template": {
    "promptKey": "tvm.exercise.f02.prompt",
    "parameters": [
      { "name": "pmt", "type": "currency", "min": 25000, "max": 250000, "step": 25000 },
      { "name": "rate", "type": "rate", "min": 5, "max": 10, "step": 0.5 },
      { "name": "years", "type": "integer", "min": 10, "max": 30, "step": 5 }
    ]
  },
  "solutionLogic": {
    "solverFunction": "retirementNestEgg",
    "answerType": "numeric",
    "tolerance": 0.005,
    "toleranceType": "relative",
    "partialCredit": false
  },
  "feedbackTemplates": {
    "correct": "tvm.exercise.f02.correct",
    "incorrect": "tvm.exercise.f02.incorrect"
  }
}
