{
  "id": "je-f09-monthly-depreciation",
  "playgroundSlug": "journal-entry",
  "difficulty": "fondamental",
  "template": {
    "promptKey": "je.exercise.f09.prompt",
    "parameters": [
      { "name": "depreciationAmount", "type": "currency", "min": 50000, "max": 1000000, "step": 25000 }
    ]
  },
  "solutionLogic": {
    "solverFunction": "monthlyDepreciation",
    "answerType": "journal-entry",
    "partialCredit": true
  },
  "feedbackTemplates": {
    "correct": "je.exercise.f09.correct",
    "incorrect": "je.exercise.f09.incorrect"
  }
}
