{
  "id": "bond-issue-price",
  "playgroundSlug": "interest",
  "difficulty": "intermediaire",
  "template": {
    "promptKey": "int.exercise.bond-issue-price.prompt",
    "parameters": [
      { "name": "faceValue", "type": "currency", "min": 500000, "max": 5000000, "step": 500000 },
      { "name": "couponRate", "type": "rate", "min": 5, "max": 14, "step": 0.5 },
      { "name": "marketRate", "type": "rate", "min": 5, "max": 16, "step": 0.5 },
      { "name": "termYears", "type": "integer", "min": 3, "max": 10, "step": 1 }
    ]
  },
  "solutionLogic": {
    "solverFunction": "bondIssuePrice",
    "answerType": "numeric",
    "tolerance": 0.005,
    "toleranceType": "relative",
    "partialCredit": false
  },
  "feedbackTemplates": {
    "correct": "int.exercise.bond-issue-price.correct",
    "incorrect": "int.exercise.bond-issue-price.incorrect"
  }
}
