{
  "id": "simple-interest-total",
  "playgroundSlug": "interest",
  "difficulty": "fondamental",
  "template": {
    "promptKey": "int.exercise.simple-interest-total.prompt",
    "parameters": [
      { "name": "principal", "type": "currency", "min": 500000, "max": 5000000, "step": 100000 },
      { "name": "rate", "type": "rate", "min": 4, "max": 15, "step": 0.5 },
      { "name": "termYears", "type": "integer", "min": 1, "max": 5, "step": 1 }
    ]
  },
  "solutionLogic": {
    "solverFunction": "simpleInterestTotal",
    "answerType": "numeric",
    "tolerance": 0.005,
    "toleranceType": "relative",
    "partialCredit": false
  },
  "feedbackTemplates": {
    "correct": "int.exercise.simple-interest-total.correct",
    "incorrect": "int.exercise.simple-interest-total.incorrect"
  }
}
