{
  "id": "apr-with-fees",
  "playgroundSlug": "amortization",
  "difficulty": "avance",
  "template": {
    "promptKey": "am.exercise.apr.prompt",
    "parameters": [
      { "name": "principal", "type": "currency", "min": 5000000, "max": 15000000, "step": 1000000 },
      { "name": "annualRate", "type": "rate", "min": 0.06, "max": 0.12, "step": 0.005 },
      { "name": "months", "type": "periods", "min": 36, "max": 84, "step": 12 },
      { "name": "originationFee", "type": "currency", "min": 50000, "max": 300000, "step": 25000 }
    ]
  },
  "solutionLogic": {
    "solverFunction": "aprWithFees",
    "answerType": "numeric",
    "tolerance": 0.002,
    "toleranceType": "absolute",
    "partialCredit": false
  },
  "feedbackTemplates": {
    "correct": "am.exercise.apr.correct",
    "incorrect": "am.exercise.apr.incorrect"
  }
}
