{
  "id": "je-f03-supplier-payment",
  "playgroundSlug": "journal-entry",
  "difficulty": "fondamental",
  "template": {
    "promptKey": "je.exercise.f03.prompt",
    "parameters": [
      { "name": "paymentAmount", "type": "currency", "min": 200000, "max": 3000000, "step": 50000 }
    ]
  },
  "solutionLogic": {
    "solverFunction": "supplierPayment",
    "answerType": "journal-entry",
    "partialCredit": true
  },
  "feedbackTemplates": {
    "correct": "je.exercise.f03.correct",
    "incorrect": "je.exercise.f03.incorrect"
  }
}
