{
  "id": "cvp-f02-target",
  "playgroundSlug": "cvp",
  "difficulty": "fondamental",
  "template": {
    "promptKey": "cvp.ex.target.prompt",
    "parameters": [
      { "name": "price", "type": "currency", "min": 20, "max": 200, "step": 5 },
      { "name": "variableCost", "type": "currency", "min": 5, "max": 100, "step": 1 },
      { "name": "fixedCosts", "type": "currency", "min": 20000, "max": 300000, "step": 5000 },
      { "name": "targetProfit", "type": "currency", "min": 10000, "max": 200000, "step": 5000 }
    ]
  },
  "solutionLogic": {
    "solverFunction": "target",
    "answerType": "numeric",
    "tolerance": 1,
    "toleranceType": "absolute"
  },
  "feedbackTemplates": {
    "correct": "cvp.ex.correct",
    "incorrect": "cvp.ex.incorrect"
  }
}
