{
  "id": "je-f08-salary-accrual",
  "playgroundSlug": "journal-entry",
  "difficulty": "fondamental",
  "template": {
    "promptKey": "je.exercise.f08.prompt",
    "parameters": [
      { "name": "salaryAmount", "type": "currency", "min": 250000, "max": 2500000, "step": 50000 }
    ]
  },
  "solutionLogic": {
    "solverFunction": "salaryAccrual",
    "answerType": "journal-entry",
    "partialCredit": true
  },
  "feedbackTemplates": {
    "correct": "je.exercise.f08.correct",
    "incorrect": "je.exercise.f08.incorrect"
  }
}
