{
  "id": "compound-fv",
  "playgroundSlug": "interest",
  "difficulty": "fondamental",
  "template": {
    "promptKey": "int.exercise.compound-fv.prompt",
    "parameters": [
      { "name": "principal", "type": "currency", "min": 500000, "max": 5000000, "step": 100000 },
      { "name": "rate", "type": "rate", "min": 4, "max": 14, "step": 0.5 },
      { "name": "years", "type": "integer", "min": 2, "max": 10, "step": 1 }
    ]
  },
  "solutionLogic": {
    "solverFunction": "compoundFv",
    "answerType": "numeric",
    "tolerance": 0.005,
    "toleranceType": "relative",
    "partialCredit": false
  },
  "feedbackTemplates": {
    "correct": "int.exercise.compound-fv.correct",
    "incorrect": "int.exercise.compound-fv.incorrect"
  }
}
