{
  "id": "je-f01-basic-cash-sale",
  "playgroundSlug": "journal-entry",
  "difficulty": "fondamental",
  "template": {
    "promptKey": "je.exercise.f01.prompt",
    "parameters": [
      { "name": "saleAmount", "type": "currency", "min": 500000, "max": 5000000, "step": 100000 }
    ]
  },
  "solutionLogic": {
    "solverFunction": "basicCashSale",
    "answerType": "journal-entry",
    "partialCredit": true
  },
  "feedbackTemplates": {
    "correct": "je.exercise.f01.correct",
    "incorrect": "je.exercise.f01.incorrect"
  }
}
